"","X","Duration..in.seconds.","Pre_P1","Pre_P2","Pre_P3","Pre_P4","UTIL_1","UTIL_2","UTIL_3","UTIL_4","UTIL_5","UTIL_6","DEON_1","DEON_2","DEON_3","DEON_4","DEON_5","DEON_6","SILS_1_1","NLINE","SNS_SCORE","condition","P1","P2","P3","P4","Suprise_1","Suprise_2","Suprise_3","Suprise_4","GSS_1","GSS_2","GSS_3","GSS_4","CRR_1","CRR_2","CRR_3","CRR_4","Age","Gender","Race","School_Year","Like_Free_Response","Hard_Free_Response"
"170",362,550,50,33,71,100,4,4,4,3,5,5,1,3,4,3,3,3,3,1.58478072103335,3.375,"High",48,40,91,100,2,4,1,1,51,33,72,100,67,33,83,100,19,1,"1",1,"I like how that study asked for my opinion at the end. ","It was hard to guess what others people were thinking. "
"171",365,685,68,81,11,0,4,4,4,4,4,4,3,2,4,2,3,4,4,0.718293297345929,4.75,"High",100,80,50,100,1,1,4,1,81,65,34,5,92,49,100,100,18,1,"1",1,"It was interactive with the slide bar ","none"
"172",367,215,57,48,43,69,1,2,3,2,4,4,4,3,4,4,5,4,3,4.78674759976865,4.125,"High",63,71,75,69,4,3,3,2,65,62,55,86,61,68,60,52,18,2,"1",1,"The diversity","None"
"173",368,410,63,94,69,100,4,4,4,3,5,5,2,3,4,3,3,4,3,2.6314378638905,3.875,"High",83,92,77,100,4,3,1,1,71,63,58,100,93,80,85,100,18,2,"1,5",1,"I liked how it gave us the actual percentages and asked how suprised we were. ","none."
"174",370,471,62,22,71,79,4,4,4,2,4,5,2,2,4,4,2,4,4,0.982269609922242,4.125,"High",83,80,82,83,4,4,4,4,72,61,91,100,91,88,88,88,18,2,"1",2,"I liked learning about what the world thought of the statements. ","Deciding what I agreed or strongly agreed with. "
"175",373,570,50,70,50,100,4,4,3,3,4,4,4,3,3,2,3,3,4,1.80445704003599,2.5,"High",70,80,69,100,1,1,4,1,40,70,50,100,81,70,50,100,18,2,"1,2",1,"It was repetitive","I got confused as to why it was repetitive"
"176",375,604,71,65,18,100,4,4,4,3,4,4,3,4,4,4,4,4,4,3.31225056230319,3.75,"High",77,73,30,100,1,1,4,1,70,70,20,100,73,81,40,100,18,1,"1",1,"trying to estimate what the american public thinks about the given topics","trying to estimate what the american public thinks about topics"
"177",377,556,62,62,74,100,4,4,4,4,2,4,1,2,3,3,2,2,5,2.14142980528244,3.875,"High",64,21,70,100,1,4,3,1,63,64,61,100,55,54,55,100,19,1,"1",1,"It look at al sides","None"
"178",379,838,51,68,63,100,2,4,4,2,3,4,4,4,4,4,4,4,4,1.56351551956815,3,"High",31,70,51,100,2,1,2,1,45,64,68,100,74,80,35,100,20,2,"1",3,"I like how the issues allow for a ranking that ranges from 1-100 rather than just saying ""agree, disagree, etc.""","I was challenged to think about how much I believe in these issues and how much I view them to be world issues."
"179",380,482,84,71,16,100,3,4,5,3,4,5,2,3,3,3,3,2,4,2.88281393226656,2.125,"High",81,83,7,100,2,4,5,2,60,51,29,91,56,69,55,100,19,2,"1",2,"It was short and simple and interesting ","Not any "
"180",383,905,39,58,52,84,3,4,4,3,4,5,3,2,2,3,4,4,3,1.22848243686138,4.125,"High",42,47,81,100,1,1,3,1,84,50,19,100,82,100,100,100,18,1,"1",1,"there was variety in questions; I also liked how there were choices for 2018 and 2023 differences.","I did not face many challenges at all while doing the exercise."
"181",384,527,80,50,100,100,4,4,5,4,4,5,2,2,3,3,2,3,3,0.956985733564681,3.875,"High",80,50,100,100,2,3,5,1,50,20,35,85,80,90,90,99,18,1,"1",1,"I liked that I was given the actual statistics of what Americans answered","Thinking about how I felt within the issues presented "
"182",387,761,59,77,51,100,5,5,4,3,5,4,2,2,3,2,3,4,4,2.96561430499325,4.125,"High",70,94,53,100,1,3,5,1,68,44,34,97,93,91,86,99,19,2,"1",1,"I liked that I saw the actual percentages of what I estimated. ","There were too many numbers to choose from. "
"183",389,597,0,10,20,100,4,4,3,5,1,5,1,2,4,5,3,5,5,1.53150599575863,4.625,"High",2,10,20,100,1,1,1,2,72,72,20,81,100,100,3,100,18,2,"1",2,"It was interesting and I learned some things about what people thought in 2018","Some of the questions I didn't understand "
"184",390,666,76,57,34,100,3,5,5,4,4,4,3,3,3,4,4,4,3,3.92219171004434,3.75,"High",78,68,90,100,2,4,5,1,82,67,21,100,79,93,72,100,18,1,"1",1,"I like our nation to come together and agree on different problems no matter what race, ethnicity, or gender we are. ","I was confused about why the majority of the nation should allow the death penalty. I had thoughts running through my head of different perspectives such as if the case was a stranger or a friend of mine. Then is becomes a difficult decision,, "
"185",392,596,100,100,50,100,2,4,5,3,5,5,1,1,2,2,3,2,4,1.66817303515198,3.875,"High",100,100,48,100,3,2,5,1,89,83,60,100,95,98,58,100,18,2,"1",1,"I liked the guessing of the overall statistics ","I didn't know what some of the questions meant"
"186",395,967,54,51,78,50,3,4,4,3,4,5,3,4,3,3,4,4,4,6.16909363151468,3.5,"High",53,57,48,39,4,3,4,3,53,63,76,49,49,33,66,41,19,2,"1",1,"I liked how the questions were real life problems and a huge debate around the world and that people have many different views of each topic discussed.","One challenge that I struggled with from the exercise is answering is on some of the choices for the debates."
"187",397,14050,100,50,100,100,3,2,3,3,3,3,3,3,3,3,3,3,4,6.15383819805925,3.25,"High",100,72,80,100,1,1,1,1,100,50,70,100,100,80,80,100,22,1,"2",4,"I like that I got to see the percentage of people who agree with what I agree with ","I was challenged by the implementation of free healthcare, I believe it is a debatable matter. "
"188",399,3030,65,65,67,67,4,4,4,4,4,4,4,4,4,4,4,4,4,6.67748093310199,5.5,"High",80,100,100,100,4,4,4,4,88,84,85,86,80,81,80,84,18,2,"1,3",1,"Discussion","None"
"189",400,2250,100,50,50,100,4,4,5,4,4,3,1,3,4,3,4,3,4,0.91211305186042,4.25,"High",100,50,50,100,1,3,2,2,51,63,65,76,72,69,59,98,NA,NA,"",1,"It made me reflect on past world issues. Usually I only focus on current events, so it helped me to think about back to events that I might have forgotten about.","It was difficult to try and guess the opinion of the general population. Our country is full of different viewpoints, so it is challenging to guess which opinion is dominant. "
"190",403,496,100,30,100,100,4,4,4,3,4,5,2,4,2,3,3,4,4,0.770917357496305,5.125,"High",90,29,100,100,1,2,1,1,74,49,79,97,74,67,71,99,19,1,"1",2,"thought provoking questions","N/a"
"191",404,344,100,100,2,100,4,3,4,4,4,3,4,3,4,3,4,3,3,6.44948093310199,5.5,"High",100,100,0,100,4,4,4,4,100,100,1,100,60,71,50,100,19,1,"2",1,"It widened my perspective.","I was confused at first but then understood it."
"192",407,533,30,50,29,100,4,2,4,3,4,4,3,3,3,3,3,3,1,2.1709997686524,3.625,"High",60,60,80,100,3,1,1,1,22,51,61,60,80,60,60,100,19,1,"1",1,"it was short and simple ","learning about problems in America "
"193",409,490,70,40,60,100,5,5,4,4,4,3,2,4,3,3,4,3,4,0.977836488657541,4.625,"High",70,22,87,100,1,5,1,1,70,21,60,100,94,94,83,100,20,1,"1",2,"It was a unique surveying method.","I was confused on the point of the estimation at first."
"194",411,1098,100,75,0,100,5,5,5,5,5,5,1,3,2,2,3,2,5,1.62702980528244,4.5,"High",100,66,4,100,1,3,5,1,64,29,40,100,98,52,62,100,20,2,"1",2,"Easy to take","N/A"
"195",412,741,72,90,97,100,5,5,5,3,4,5,2,3,2,4,2,2,3,0.850710879763511,4.375,"High",78,89,99,100,1,3,5,1,94,74,39,100,95,87,77,100,19,1,"1",2,"I liked how we were able to see how people in previous years thought about these questions.","I had no challenges completing this exercise."
"196",414,745,100,67,40,100,4,4,5,3,4,4,4,1,2,2,3,4,4,3.8612378638905,4,"High",100,72,38,100,5,2,3,1,81,30,72,100,92,84,61,100,19,2,"6",2,"I enjoyed seeing what others thougth about certin social and enviromental issues.","No challenges "
"197",417,255,62,60,70,100,3,3,3,3,3,3,3,3,3,3,3,3,3,4.30018072103335,3.875,"High",69,56,72,77,3,3,3,3,55,53,68,87,67,49,78,57,NA,2,"1",2,"na","na"
"198",418,706,96,90,1,100,5,5,5,4,3,4,2,3,4,4,3,4,2,6.77047140929246,3.625,"High",100,100,67,100,1,1,4,1,100,100,1,100,100,100,80,100,18,2,"5",1,"One thing I liked about this exercise was being able to guess what people had thought about specific questions. ","The only challenge I faced while completing this exercise was guessing how people felt back in 2018 because I was not following political ideals at the time. "
"199",422,1567,100,80,80,100,4,4,3,4,3,4,3,3,3,4,3,3,3,1.72447291305186,4.25,"High",100,86,94,100,1,2,1,1,81,72,85,97,90,84,56,97,18,1,"2",1,"The comparison in statistic based on what thought it would look like vs what it actually was","N/A"
"200",423,323,80,100,2,100,4,4,5,5,5,5,5,3,4,3,4,4,3,8.03807140929246,2,"High",100,100,24,100,5,5,5,1,46,45,34,5,75,82,45,94,18,2,"1",1,"It had research surveys to actually show how many Americans think of a particular topic and issue.","None."
"201",425,2122,71,70,74,100,4,4,4,4,4,5,2,3,2,2,4,4,3,1.08931906689801,3.75,"High",76,83,60,100,4,3,1,1,41,36,61,84,61,40,84,100,18,2,"1",1,"It asked if I was surprised by Americans answers.","Trying to estimate what America thinks."
"202",427,268,34,30,48,37,2,3,4,3,4,3,3,2,4,4,3,3,5,3.11972504337768,3.875,"High",45,39,45,42,2,3,3,2,46,33,42,40,48,29,60,54,18,2,"1",1,"It was interesting","It made me think"
"203",429,731,100,83,91,100,4,3,5,4,3,5,4,3,4,5,4,4,5,1.81517132575027,4.375,"High",59,100,81,85,3,4,4,1,79,69,69,100,90,100,83,89,19,2,"1",1,"it was surprising to me ","it was hard to think what the global population would think of "
"204",430,320,92,95,74,100,5,5,4,4,4,5,2,2,1,2,2,3,4,2.74171551956815,3.625,"High",100,100,77,100,4,5,5,5,61,42,80,82,100,91,57,100,19,2,"1",1,"I liked looking at the responses over the years and how they change.","None "
"205",433,903,84,49,15,100,3,3,3,3,3,4,2,2,2,3,3,3,3,3.71347742433006,2.625,"High",81,45,10,100,1,3,3,3,51,29,3,100,60,29,30,92,19,2,"1",2,"It was interesting","I was confused at times"
"206",435,400,86,60,82,100,4,4,4,4,5,4,2,2,3,2,4,2,5,4.3885616734143,4.25,"High",90,95,100,100,1,1,1,1,66,52,45,92,87,80,90,100,18,2,"1",1,"I like being able to compare my answers to others, and seeing the comparison. ","None "
"207",436,1662,93,80,55,100,4,5,5,3,5,5,3,3,3,3,4,4,2,1.81993774179037,3.125,"High",85,81,76,100,1,2,2,1,62,48,70,89,71,72,83,100,18,2,"1",1,"I liked that I could rank where I thought each statement would be.","Deciding what I thought about each statement or question."
"208",439,483,100,60,20,100,3,4,3,3,2,4,2,2,2,3,3,4,3,3.61826008611272,4,"High",100,91,50,100,2,2,3,1,100,60,19,100,100,91,72,100,18,1,"5",1,"I think it is interesting to start with your own opinion and slowly learn more about others'. It changed my perspective in a sense.","It wasn't challenging"
"209",441,625,100,58,62,100,4,4,4,3,4,4,3,3,2,4,3,4,3,0.768490495469443,3.75,"High",87,90,58,100,3,1,5,1,83,81,50,100,89,95,75,100,19,1,"1",1,"It opened my eyes to how my views reflect the majorities views.","N/A"
"210",442,4065,51,62,53,100,4,4,4,3,3,5,3,4,3,4,4,4,3,2.22963648865754,4.5,"High",69,78,77,100,1,1,1,1,70,80,50,100,68,82,70,100,19,2,"1",1,"I liked the diversity of the questions ","I didn't have any "
"211",444,603,95,84,1,100,4,5,5,5,5,5,5,1,2,3,4,4,2,1.05408865754129,2.625,"High",100,89,1,100,2,1,5,2,94,78,26,100,100,90,1,100,18,2,"1,3",1,"That on average the population in 2018 does not think how I thought they did in terms of capital punishment.","Understanding why people support capital punishment so much."
"212",446,1094,75,92,45,97,4,4,4,4,3,5,2,3,3,2,3,3,3,2.41346506008611,3.25,"High",89,93,70,99,4,2,1,1,42,71,80,19,85,90,87,96,19,2,"1",1,"I liked the aspect of predicting what i thought the result were, then being able to see the real results. ","Just deciding how much of a percentage i actually felt about something "
"213",449,736,75,85,60,100,3,4,4,3,4,4,4,4,3,3,3,4,3,3.16071087976351,3.25,"High",75,85,60,100,1,2,2,1,50,65,75,100,86,86,75,100,18,2,"2",1,"I liked how my predictions were pretty close and that there are other people who think like me.","In 2018 I was in middle school so it was pretty hard to predict those from the eyes of a 13 year old."
"214",451,1255,64,46,72,100,4,3,3,3,4,3,2,3,3,2,4,3,4,0.65011418289313,3.375,"High",54,64,69,100,4,4,2,1,38,43,69,91,76,84,87,100,19,1,"1",1,"It taught me some changes in the opinion of the society in the last 5 years.","Determining my stance on these questions."
"215",452,591,72,87,100,100,4,4,3,4,4,5,4,4,4,4,4,4,3,1.00734262579526,3,"High",100,100,100,100,2,2,2,2,72,72,44,100,100,100,100,100,18,2,"1",1,"Seeing the results of the rest of the United States and how other people reacted to these surveys and questions. ","Not much"
"216",454,459,50,72,19,100,4,4,4,4,4,4,3,3,4,4,4,4,2,3.84867107512371,4.625,"High",50,70,19,97,2,3,3,3,50,49,20,93,71,71,39,92,NA,NA,"",NA,"I showed me the comparisons of my answers to what the general population thought","N?A"
"217",455,705,100,65,80,100,2,4,5,4,4,4,2,2,3,3,2,4,3,0.948607583060215,3.75,"High",90,85,85,100,1,4,1,1,39,65,60,90,65,70,75,95,19,1,"1",1,"I enjoyed having the real data from 2018 presented after I tried to predict it since it made the data stick with me more than if I just read it.","None"
"218",458,560,81,66,57,100,3,5,4,3,3,5,1,3,3,3,3,1,4,3.02078072103335,4.125,"High",81,86,67,100,3,2,4,3,82,69,67,76,74,74,89,90,18,1,"2",1,"It gave some interesting things to think about","None "
"219",461,659,89,50,49,100,3,4,4,4,4,5,3,4,4,4,4,4,3,4.00927107512371,3.25,"High",70,48,48,100,4,2,2,1,65,78,43,100,73,74,67,100,18,2,"1",1,"i liked the topics the research study choose","it was hard guessing what the past studies of the topics"
"220",462,698,90,100,0,100,4,3,5,5,4,5,1,3,4,3,4,4,5,4.88984434162329,4,"High",100,100,0,100,5,3,5,1,100,100,10,100,70,71,50,100,18,2,"1",1,"instead of an essay, question-based assignment it was interactive. it was more interactive and fun to do.","n/a"
"221",465,1498,100,100,20,100,4,4,5,2,5,4,2,2,1,2,3,2,4,1.0291616734143,4.5,"High",90,80,20,100,1,2,1,1,60,70,80,70,90,90,40,100,18,2,"1",1,"Real world problems","Determining the world's opinions on these topics. "
"222",467,506,82,99,0,100,4,4,5,4,5,5,3,3,5,2,5,5,3,3.50873627658891,2.5,"High",90,100,75,100,1,5,2,4,60,39,40,81,94,92,76,100,19,2,"2",2,"That it told the actual percentages after having us guess","not knowing the full information to every question "
"223",470,810,100,90,41,100,4,4,4,4,3,4,3,3,3,3,3,3,3,4.56507140929246,4.125,"High",100,96,51,100,5,2,3,1,81,70,71,92,95,99,75,100,19,2,"1",1,"I liked seeing what some of the population answered to the questions. ","I didn't have any challenges. "
"224",472,163,45,67,51,74,1,2,3,4,5,4,5,4,3,2,2,1,4,5.51423648865754,4,"High",46,61,95,12,5,4,3,2,33,55,79,46,74,56,53,78,18,1,"1",1,"how i was able to really express myself with the many different options ","making sure i chose the right answer "
"225",474,613,100,77,15,0,4,4,5,4,5,4,1,2,1,2,1,3,2,0.743168151147099,3.875,"High",100,85,15,100,2,3,5,1,70,45,20,0,90,80,50,100,19,1,"1",1,"It was interesting seeing how people from 2018 answered.","Misread the last question on my first go through"
"226",475,440,100,100,66,100,4,3,4,3,5,5,3,4,2,3,4,1,1,1.25484421309684,2.75,"High",100,100,66,100,1,3,1,1,82,51,77,100,90,85,61,100,18,1,"1",1,"I liked seeing the survey data from 2018. ","Thinking about what other people's opinions might be. "
"227",478,5264,44,12,45,0,3,2,3,2,3,3,4,3,3,2,2,3,4,4.4057472655999,3.75,"High",48,44,33,1,3,3,3,2,46,51,37,1,45,46,43,1,20,1,"1",2,"I like how we got to change our answer at the end. I think it was interesting with how people change there mind with time. ","I was weird wrapping my head around how opinions change over time and ensuring how many people would agree. "
"228",480,683,50,81,100,100,4,4,5,5,4,5,3,4,3,5,3,5,5,2.70709500674764,4,"High",60,80,100,100,3,2,1,1,61,81,100,100,100,100,100,100,18,2,"1",1,"asked my opinion and other perspectives on the topic","i did not have any challenges. "
"229",481,1643,100,100,29,100,4,4,5,4,4,4,1,3,3,2,3,3,1,2.44264434162329,2.125,"High",100,100,33,100,1,1,1,1,63,51,70,86,100,100,32,100,18,2,"1",1,"The time comparison ","Nothing"
"230",484,281,89,45,100,99,3,3,3,3,3,3,3,3,3,3,3,3,5,4.00621393226656,3.875,"High",78,86,100,100,3,3,4,1,81,87,100,97,72,61,89,96,20,2,"1",3,"The stats.","Agreeness"
"231",486,433,47,49,0,100,3,3,3,3,3,3,3,3,3,3,3,3,1,3.94376167341431,3.125,"High",52,57,0,100,1,1,1,1,54,82,21,5,44,76,5,1,20,1,"1",3,"I liked seeing how opinions differed throughout the years.","Trying to predict what people thought in 2018."
"232",487,88042,42,63,35,0,3,3,3,3,3,3,3,3,3,3,3,3,3,2.97692859070754,4.625,"High",22,54,37,100,3,3,3,3,30,76,64,100,68,81,83,100,18,1,"1",1,"It was simple","Nothing was really challenging"
"233",489,1063,100,100,0,100,4,3,5,4,2,5,4,3,3,3,1,1,4,2.02385240023135,2.5,"High",100,100,2,100,1,3,1,1,61,40,71,100,91,92,50,100,18,1,"1",1,"It was very straight forward and wasn't overly complicated or long","Some of the answers I thought of were ambiguous. "
"234",491,480,49,84,12,100,4,4,4,4,5,5,1,1,2,4,2,3,5,1.00592859070754,4.625,"High",82,82,82,100,1,3,4,1,51,50,29,100,81,91,81,100,18,1,"1",1,"Showed what American thought in the 2018 study","Didn't have any"
"235",492,173,52,44,78,83,2,2,3,2,4,3,3,2,2,4,4,3,1,5.26783648865754,4,"High",57,65,50,84,2,4,3,4,88,84,63,71,84,85,18,22,20,1,"1",2,"The specific scroll numbers","Remembering and separating the years of context "
"236",494,88222,72,37,49,28,2,2,3,2,3,3,1,3,3,2,3,4,2,6.68024283786389,2.625,"High",55,43,67,65,3,4,4,4,31,29,49,96,84,83,80,82,20,1,"5",2,"I enjoyed how it was very involved and made me take things into perspective.","Understanding some of those facts were difficult to comprehend."
"237",497,254,46,61,42,65,3,3,3,3,3,3,3,3,3,3,3,3,3,4.05219341944605,3.875,"High",50,55,48,58,3,3,3,3,53,50,50,68,47,54,48,57,19,1,"1",1,"It gave me a new perspective on different standpoints. ","No challenges "
"238",498,1799,63,83,62,100,1,3,2,1,3,4,5,4,5,4,5,4,4,4.00508097165992,4.375,"High",69,76,57,92,4,4,3,1,66,63,56,89,68,67,60,87,18,2,"1",1,"Nothing","Nothing"
"239",501,1427,77,50,38,100,3,3,4,4,5,5,1,1,3,4,4,4,2,3.7122047426258,3.625,"High",86,50,43,100,2,1,4,2,90,50,42,100,69,80,80,99,19,1,"1",1,"It re-evaluated my opinion and the American public's opinions on topics that are very important in the US.","I sometimes second guessed myself if i actually agreed or disagreed with something."
"240",502,1066,100,100,15,100,4,4,5,4,5,5,1,2,2,3,4,3,3,0.947067900520532,4.5,"High",100,100,13,100,1,2,4,1,60,70,40,100,81,81,60,100,18,2,"1",1,"It was interesting to see what people's perspectives were 5 years ago on issues that are still very prevalent and often talked about.","I didn't have any challenges with the exercise as I am pretty open about my thoughts on the previous topics."
"241",505,286,50,51,50,51,3,3,3,3,3,3,3,3,3,3,3,3,3,5.71502696484802,3.75,"High",50,51,49,52,3,3,3,3,50,51,51,51,50,51,50,50,18,1,"1",1,"everything","stress"
"242",507,610,90,72,29,100,4,4,5,3,3,5,3,3,2,4,3,3,3,1.11863331405437,3.75,"High",91,82,14,100,2,4,5,1,60,60,59,100,92,81,10,100,20,1,"1",2,"I liked learning about these cool statistics","I briefly struggled to remember what was even happening in 2018."
"243",508,583,100,70,35,100,2,2,5,4,4,5,2,2,2,2,3,4,3,1.26911906689801,3.5,"High",100,85,40,100,1,4,4,1,65,55,45,90,80,85,60,99,18,1,"1,2",1,"How it showed the opinion of the collective American populace. The results were very surprising. ","Nothing was challenging for me. "
"244",511,770,100,100,20,100,4,4,5,3,4,5,2,2,4,3,4,4,4,3.67154409099672,4.375,"High",100,100,17,100,1,2,3,1,81,76,73,100,92,85,46,100,18,2,"1",1,"I like that it showed the actual results versus our predicted outcomes. ","Being able to gauge the mindsets of individuals in 2018"
"245",512,1546,70,60,60,100,3,4,4,3,3,4,3,4,3,3,3,4,3,0.895315519568151,3.75,"High",60,75,85,100,1,1,2,1,60,65,50,90,64,80,80,99,18,2,"2",1,"It made me think about things that I usually would not. ","Some parts of it I just didn't really understand so I had to do a bit of research. "
"246",514,1057,100,100,71,100,4,5,5,3,4,5,3,3,4,4,4,4,4,1.22268230833494,3.875,"High",100,100,65,100,3,3,2,4,20,40,80,70,100,80,54,100,18,2,"1,2",1,"It showed the results of the other study, so I was able to compare.","I had trouble deciding about the death penalty questions because it is a very ""it depends on the situation"" type of question."
"247",517,306,71,49,100,100,3,3,3,3,4,2,2,2,2,3,4,4,4,4.39430453055716,4.125,"High",58,23,100,99,4,2,2,1,76,80,30,64,61,26,29,66,21,2,"1",2,"It gave me new info I didn't previously know. ","I was shocked at some of the stats"
"248",518,1133,100,30,80,100,3,4,5,3,2,5,1,3,1,3,3,3,5,0.990505995758627,4.25,"High",100,2,52,100,4,5,3,1,90,69,52,100,100,81,85,100,18,1,"1",1,"It was short and the questions were clear","none
"
"249",521,1092,79,91,39,100,4,4,5,3,4,4,2,4,3,2,3,3,4,4.18049363151468,3.875,"High",85,75,42,100,4,4,3,1,41,32,95,33,87,90,26,100,18,2,"5",1,"it implemented information from a couple years ago.","not knowing some things "
"250",523,690,67,30,40,100,4,4,4,3,4,3,2,2,3,3,3,4,4,1.8710587494377,3.25,"High",61,40,30,100,1,4,4,1,60,50,30,100,92,86,76,100,19,1,"1",1,"I enjoyed the wide variety of questions.","I didnt really face challenges I was just surprised on some of the results in the 2018 and 2023 polls."
"251",525,848,100,100,16,100,3,4,4,4,5,5,2,2,3,3,3,3,3,1.16488448043185,3.125,"High",100,87,32,100,4,5,3,2,59,42,64,92,90,93,93,99,20,2,"1",3,"I like that every topic was one that I have a good amount of knowledge on.","It was somewhat difficult to accurately guess what the rest of the us thinks about those topics. "
"252",6,830,100,100,10,100,5,5,3,4,3,5,3,3,2,3,3,4,5,1.60045236167341,3.625,"Low",100,100,1,100,5,1,2,1,60,70,40,60,60,40,30,100,21,1,"1",4,"I liked the additional information of what the actual statistics were back in 2018. It gives some insight to what life was actually like back then without the haze of nostalgia. I was in Highschool so those issues weren't as front and center in my life as I remembered (I took my government class in my freshmen year back in 2016 and my US history in 2018). ","COVID really altered what life was like back then. For instance, my friends and I watched a Vine compilation (internet videos before tik tok came to life) and they mentioned movies and pop culture that I viewed were much more recent than it actually was. So, my perception of reality was skewed a bit"
"253",8,596,70,79,15,100,4,4,4,5,4,4,2,3,2,3,3,4,4,0.539177546430178,3.625,"Low",65,70,15,100,4,4,3,1,60,80,48,90,68,75,30,100,20,1,"1",3,"I liked hearing about how people of the past responded to these questions.","None"
"254",10,691,58,84,0,100,3,4,4,3,4,4,3,2,2,3,2,4,3,1.57565373690637,2.125,"Low",54,72,0,100,1,2,1,1,29,18,63,0,41,45,31,100,20,2,"1",3,"that it asked me the percentage I thought agreed with the statements and showed me what the actual percentage was because I didn't know.","how the ethical and unethical questions were stated."
"255",11,500,100,100,100,100,4,4,4,4,4,4,2,1,2,4,2,4,4,0.745009292461924,5.25,"Low",99,98,3,83,1,1,2,1,100,100,100,100,71,53,32,98,18,1,"1",1,"how the questions were worded","thinking through some of the problems as if I was in someone else's shoes"
"256",14,443,100,100,0,100,5,5,5,4,5,4,2,3,2,2,2,4,5,5.16221393226656,3.75,"Low",95,92,6,100,1,2,4,4,43,19,69,83,71,64,45,97,19,2,"1",3,"The questions were thought provoking","I had to think about some things that I hadn’t considered in awhile"
"257",15,655,75,71,16,100,4,4,4,3,2,3,2,2,3,2,3,2,1,3.8868378638905,4.25,"Low",64,50,20,100,2,1,4,1,83,51,30,92,72,81,16,100,18,2,"1",1,"I liked seeing actual results after guessing.","No challenges"
"258",19,398,78,60,59,100,4,4,4,4,3,3,3,3,3,4,4,4,5,3.60852675277938,3.125,"Low",77,57,51,100,4,3,3,1,56,49,40,99,74,51,41,99,19,2,"1,5",3,"What I liked about this exercise is that it made me think about how others think/feel about certain topics","A challenge I faced was thinking about others views and perspectives"
"259",20,480,100,100,50,100,5,5,5,4,5,5,5,5,5,5,5,5,5,5.5666047426258,4.125,"Low",100,100,47,100,5,5,3,1,100,100,52,100,100,100,54,100,39,2,"2",4,"The things I enjoyed was seeing what the percentages were regarding, capital punishment and slavery","No challenges.  Everything was straight forward. "
"260",23,505,82,73,58,100,4,4,4,4,4,4,2,4,4,4,4,4,2,4.01376029818135,3.75,"Low",81,84,56,100,4,4,4,1,100,100,60,100,81,70,51,100,20,2,"1",3,"I liked how I answered the questions then I got to see the percentage of people that put similar answers to mine","picking an exact percent of how much I agreed or disagreed "
"261",24,612,75,65,50,100,2,3,4,2,5,5,1,2,2,2,3,2,4,2.86846960992224,3.75,"Low",65,55,50,100,4,4,5,2,55,45,50,85,55,50,37,99,20,2,"1",3,"I enjoyed learning about the public polls.","I am a bit unknowledgeable about green house emissions, so I didn't know how to accurately answer the question."
"262",26,620,100,100,19,100,4,4,4,2,5,5,2,2,4,4,2,2,3,2.68060758306021,3.75,"Low",100,85,NA,100,4,3,2,1,61,32,55,97,75,61,20,100,20,2,"1",3,"I liked being able to compare my own opinions with the American consensus. ","It forced me to confront my own standing on things and have to gauge them against societies viewpoint"
"263",29,1018,92,60,55,100,3,4,5,4,5,4,2,2,3,3,4,2,4,1.18912688130583,4.5,"Low",75,31,22,100,5,1,2,1,65,40,19,95,63,45,30,98,20,2,"1",3,"I like how I was able to estimate the 2018 poll results and then able to respond on my level of surprise (or not) to the results!","I felt as though after viewing the 2018 results from other Americans, it made me question my own thoughts on some of the questions. For example, if I answered 80% agree and the results reflect that the average answer was 40% from the rest of the pollers, it made me wonder why or what the thinking process was and maybe changed my answers the second time I was asked the same questions. "
"264",30,408,60,10,80,100,4,4,5,3,4,3,2,3,4,3,4,3,4,2.87332708694814,3.875,"Low",35,10,76,100,2,2,3,1,75,68,44,100,55,37,58,100,21,1,"1",3,"got to see public perception of certain issues.","None."
