"","X","Duration..in.seconds.","Pre_P1","Pre_P2","Pre_P3","Pre_P4","UTIL_1","UTIL_2","UTIL_3","UTIL_4","UTIL_5","UTIL_6","DEON_1","DEON_2","DEON_3","DEON_4","DEON_5","DEON_6","SILS_1_1","NLINE","SNS_SCORE","condition","P1","P2","P3","P4","Suprise_1","Suprise_2","Suprise_3","Suprise_4","GSS_1","GSS_2","GSS_3","GSS_4","CRR_1","CRR_2","CRR_3","CRR_4","Age","Gender","Race","School_Year","Like_Free_Response","Hard_Free_Response"
"350",211,1731,100,100,2,100,4,4,5,4,5,5,2,2,4,2,2,4,4,0.728215770194718,4.25,"Low",100,100,3,100,2,4,1,1,63,24,38,99,53,35,30,99,19,3,"1",1,"I enjoyed answering and guessing estimates","None"
"351",213,500,91,89,1,100,4,4,4,4,4,4,2,4,3,2,4,4,4,5.58891551956815,3.875,"Low",93,85,1,100,3,2,2,1,82,80,8,1,92,93,6,100,19,2,"1",2,"I like to see how just a couple of years can pass and so much can change","none"
"352",215,830,99,34,50,100,4,4,4,3,2,5,5,2,4,4,4,5,5,1.00314763832659,4.25,"Low",83,39,49,100,4,3,2,1,70,82,59,98,92,31,61,100,18,2,"1",1,"I liked that I was able to see the results of what people actually said in 2018 about the statements and how I predicted what they where going to say. I also liked how I was able to predict that some of the tends to the answers where going to increase since 2018.","Nothing"
"353",218,1389,88,97,7,100,4,4,4,3,4,4,2,2,4,3,2,4,5,0.46487926225821,5.125,"Low",93,85,12,100,4,3,1,1,66,73,40,92,65,84,32,100,18,2,"1",1,"I liked how it gave me the actual percentage of the 2018 survey rather than just leaving me guessing. I also liked how the questions were very consistent and not just random. ","I didn't really have any challenges with the exercise, besides trying to guess what other people think about the death penalty, greenhouse gas emissions, injustice, etc."
"354",220,778,100,56,32,100,4,5,5,5,5,5,1,2,1,1,2,2,4,1.10690950453056,3.75,"Low",100,63,31,100,4,4,2,1,78,67,30,100,92,77,61,100,19,2,"1",1,"the comparison from 2018 to 2023","none really"
"355",221,571,64,65,50,100,3,3,4,3,3,4,3,3,2,3,4,3,4,0.757795257374205,3.5,"Low",50,70,19,100,1,1,1,1,41,50,71,81,60,60,39,100,19,1,"1",1,"I liked that it told me the actual statistics behind the 2018 survey","N/A"
"356",224,811,69,50,0,100,4,2,3,4,4,5,2,4,3,3,5,4,5,3.71677620975516,4.625,"Low",57,45,0,100,3,4,2,1,60,78,26,100,65,76,31,99,19,1,"1",1,"The flexibility of the choices.","Moral views vs views that society wants me to have."
"357",225,1298,90,90,90,100,4,4,5,4,4,5,4,3,3,3,5,4,4,0.895306368485316,5,"Low",92,80,93,100,5,1,2,1,61,50,40,93,71,61,70,100,19,2,"1",1,"I liked seeing the general public's opinion because some things are pretty one-sided now","There weren't any challenges beyond trying to guess what the general public would've said years ago as I was younger and didn't really pay attention"
"358",227,875,84,72,3,95,3,4,5,4,5,5,1,2,2,2,3,4,3,0.997573035151983,4.375,"Low",74,59,5,70,2,3,2,4,54,45,22,44,57,44,27,29,19,2,"1",1,"Seeing the results about what Americans thought about the topics presented. ","Rating things on a scale of right and wrong"
"359",231,1649,100,100,29,100,4,4,4,4,4,5,2,2,3,3,3,3,3,8.22292708694814,2.25,"Low",100,85,30,100,1,1,1,1,41,22,76,100,100,93,2,100,18,2,"1,2",1,"I liked trying to guess the right numbers and then comparing my guesses to the actual answers. ","Identifying what some phrases meant."
"360",232,589,80,63,18,100,4,4,4,4,5,5,2,2,3,3,4,3,3,0.608080971659919,3.5,"Low",87,63,18,100,4,1,1,1,68,45,37,92,46,50,36,100,20,2,"1",2,"I liked seeing the correct answer for my guesses. ","none. "
"361",237,1759,76,65,50,100,3,3,3,3,3,3,3,3,3,3,3,3,2,6.89307140929246,1,"Low",31,32,38,27,3,3,3,3,44,44,82,30,49,69,36,71,18,2,"1",1,"i think that exercise was fun and worth doing ","nothing"
"362",238,243,64,55,59,80,3,4,2,3,4,3,2,3,4,2,3,2,3,5.39196029818135,2.75,"Low",39,37,55,43,2,3,2,3,44,41,26,52,33,66,52,48,19,2,"3",1,"it was fun!","no challenges at all!"
"363",241,659,70,100,56,100,4,5,4,4,4,5,2,2,5,5,3,1,4,1.77646192404087,3.875,"Low",72,100,52,100,4,3,1,3,50,40,30,100,91,81,53,100,19,1,"1",2,"I liked the contrast between what I thought people of the past thought and what the actual results were.","None."
"364",242,467,100,72,23,100,3,4,5,4,5,5,1,2,2,1,4,3,4,1.45772073774179,4,"Low",100,52,36,100,4,4,5,1,60,40,70,100,75,50,40,100,18,2,"1",1,"I think it is interesting that I could see the percentage of people that actually agreed with the statements, and it was not just hypothetical. ","I did not have any challenges with the exercise. "
"365",244,774,100,60,72,100,4,5,4,4,5,5,1,2,1,2,2,3,5,1.11727291305186,3.875,"Low",100,71,79,100,2,1,4,1,45,33,78,100,68,66,53,100,18,3,"1",1,"I was surprised by how divided viewpoints open controversial topics are. Its always interesting to learn how others think.","Its hard to quantify feelings about complex subjects."
"366",246,423,90,8,63,100,3,4,4,4,5,5,3,4,4,3,4,4,3,6.66919989717884,4.5,"Low",76,2,65,100,5,3,4,4,77,1,68,100,72,47,50,100,18,1,"1",1,"I thought deeper about it","I thought about other peoples responses compared to mine"
"367",248,176,52,50,50,59,3,4,3,4,3,3,3,4,4,3,4,3,3,4.98242696484802,4.125,"Low",62,73,65,68,3,4,4,4,61,70,61,76,61,71,61,76,20,2,"1",3,"my own ratings","honesty"
"368",250,680,100,100,69,100,4,4,5,4,5,5,2,2,2,2,1,4,1,0.987452400231347,3.25,"Low",100,100,59,100,4,3,1,1,60,56,84,85,81,67,61,93,18,2,"1,2",1,"Made me quantify my beliefs","Estimating how others face these same questions"
"369",252,1529,60,51,80,100,4,3,4,5,4,5,1,4,3,5,3,4,5,0.811920403573035,3.5,"Low",50,52,65,100,4,3,4,1,50,55,35,95,60,55,29,97,18,1,"5",1,"It made me think about how I view reality and see the world.","I had to look beyond myself and think about what the general public was thinking at the time."
"370",254,327,27,90,34,98,4,3,2,3,3,4,4,3,3,4,3,2,3,3.0470378638905,3.875,"Low",59,50,42,60,4,3,2,4,74,73,27,100,71,43,38,97,18,2,"1",1,"It showed me the correct answers in between ","I didn't know much about greenhouse gases so it was hard to fairly answer"
"371",255,559,66,73,19,100,4,4,5,2,5,5,2,4,4,2,4,4,5,4.21441393226656,4.375,"Low",68,82,14,100,4,4,5,1,90,92,27,96,80,91,19,98,18,2,"1",1,"Getting to guess what previous surveys have said.","None."
"372",258,1034,100,91,58,100,3,3,3,3,3,3,3,3,3,3,3,3,4,1.78434580039843,4.875,"Low",100,60,42,100,3,3,3,1,80,88,82,78,100,100,100,100,18,2,"1",1,"I liked that i got to see different prespectives.","trying to decide how i felt about difficult topics."
"373",259,1161,48,50,55,100,3,4,4,3,5,4,2,4,4,4,4,3,3,2.81845236167341,3.625,"Low",48,24,55,100,1,3,1,1,42,74,22,100,54,75,22,100,18,2,"1",1,"I like the drag of my answer. Instead of hitting a circle for my answer, I felt that the dragging of the dot made it more clear of what my answer was, and what I leaned to more. ","Not knowing how the world views greenhouse gases or the death penalty"
"374",261,999,86,70,30,95,4,4,4,3,4,4,2,2,2,3,3,2,4,3.60025056230319,4.125,"Low",90,80,50,95,3,3,5,1,40,60,20,80,69,60,30,99,18,1,"1",1,"It asked about my opinion of the issues, rather than just what I expected the population to believe.","None."
"375",263,475,85,100,18,100,3,3,4,3,3,3,3,3,3,3,3,3,3,3.46905837671101,3.625,"Low",58,100,6,100,2,3,4,1,72,82,2,100,93,77,3,100,18,2,"2",1,"I liked how I got to see the results of what others say","I had no challenges"
"376",266,433,31,2,37,100,3,3,4,3,3,3,2,2,3,3,2,2,5,4.3344079557869,5.375,"Low",31,33,50,100,1,1,3,1,4,1,24,95,22,35,51,100,21,1,"1",3,"It gave me statistics that I did not know about","I had no challenges "
"377",267,1179,37,100,8,100,4,4,5,4,5,5,4,4,1,1,2,4,5,1.3715173574963,4,"Low",69,100,2,100,3,5,5,1,61,100,3,100,70,100,3,100,19,2,"1",2,"I liked that the questions about emissions and health care stayed the same through the study. ","I did not like how what they were asking me to do slightly changed every time, making me question if I was doing it right."
"378",270,537,91,60,43,100,4,4,5,4,4,4,3,2,2,3,2,3,3,0.660719028340081,4,"Low",90,65,47,100,4,1,3,1,62,50,35,100,49,34,50,100,18,2,"1",1,"it was fairly simple","some of the questions about ethics weren't very clear"
"379",272,670,69,68,50,82,4,4,4,4,4,4,4,4,4,4,4,4,5,3.29389534091639,4.25,"Low",68,82,50,85,1,1,3,1,72,72,50,82,73,78,50,83,18,2,"5",1,"It made me think about the problems going on in the world","None"
"380",273,711,91,92,31,100,4,5,5,5,5,5,2,3,4,3,4,5,4,0.951949103528051,5,"Low",92,82,29,100,5,4,1,2,92,82,30,100,64,51,30,100,19,2,"1",1,"I liked getting to compare my results with the general public's results from different years. ","It was challenging to predict previous years' results, especially the earlier years when I, personally, was not really aware of the issues asked about."
"381",275,460,86,46,30,95,4,4,4,3,4,4,3,3,3,3,3,3,2,1.94447629329735,3.5,"Low",82,47,26,100,4,2,2,1,59,56,59,94,90,52,49,100,18,2,"1,3",1,"I liked how there was a scale to accurately generate my feelings towards the statement. ","It was hard to describe my opinions, but I did my best. "
"382",277,462,62,75,11,100,4,4,4,3,5,5,2,3,2,2,3,2,4,0.602328590707538,4.75,"Low",88,91,8,100,5,5,3,1,30,81,52,69,90,81,12,100,18,2,"1",1,"I liked how we got to compare our guesses to the actual answer to the survey ","no challenges "
"383",279,531,100,87,1,100,4,5,4,4,3,4,1,1,3,3,4,4,5,1.5876378638905,4.5,"Low",100,87,2,100,4,3,2,2,78,60,11,100,80,64,22,100,18,2,"1",1,"I enjoyed being able to see what the actual percentages were. ","I think it was hard to determine what everyone else thought about something at a certain time period. "
"384",281,447,92,61,12,100,4,4,4,3,4,4,2,3,3,3,3,2,4,4.06827107512371,4.5,"Low",86,50,5,100,1,1,3,1,50,50,39,50,51,51,30,100,19,2,"",1,"It was easy","None"
"385",284,1010,90,100,5,100,4,4,5,4,4,5,2,2,3,3,3,2,5,3.63970453055716,5.25,"Low",100,100,0,100,5,4,4,2,61,50,50,70,50,70,35,99,20,2,"1",2,"I like that I got to see the results of the 2018 study. ","I had a challenge thinking about what the whole country thought, not just people in my state. "
"386",287,645,71,71,23,100,4,4,4,4,5,5,2,2,3,3,3,3,4,5.44546860741598,5,"Low",62,65,30,100,4,2,3,1,63,47,37,83,73,68,39,100,18,2,"1",1,"It allowed me to think about issues I haven't been. ","I had no challenges."
"387",289,1171,100,90,51,100,4,4,5,4,4,3,1,2,3,3,2,3,5,0.76070954308849,4.875,"Low",100,85,50,100,2,1,1,1,60,56,75,100,92,71,20,100,21,1,"1",3,"It was insightful for me to complete the survey that had me guess what the answers would be for the general american public in 2018.","I am not very involved with politics and am not secured in many of my political opinions. Its hard for me to even figure which side of the spectrum I am on for certain questions that I feel like need context in order to be answered correctly."
"388",292,649,100,100,80,100,5,5,4,5,5,5,1,3,2,3,2,3,2,4.78189964655228,3.25,"Low",100,70,52,100,2,1,3,1,40,50,70,90,75,55,61,100,18,2,"1",1,"It asked me questions of topics that I was personally interested in.","Thinking about the range of different kinds of people that would believe in each question and where most opinions would lie."
"389",294,739,50,0,0,100,4,4,4,4,4,5,2,3,3,4,4,4,3,2.78211271769166,5.125,"Low",50,0,0,100,3,2,4,1,50,0,0,100,100,100,52,100,18,1,"1",1,"I enjoyed seeing the percent of what others thought.","It was hard to think about what my true beliefs are."
"390",295,885,65,48,85,100,3,4,4,5,5,4,2,3,4,4,3,3,4,1.37823970181865,4.5,"Low",63,41,86,100,5,2,1,1,81,82,29,100,78,80,25,100,19,2,"1",1,"It gives you a good perspective of the nation's views at different time frames over the same basic issues.","I didn't feel I knew very much about the nation's views during this time because I didn't understand many things to the extent that I do now."
"391",296,645,92,30,55,100,4,3,4,4,4,3,2,3,2,4,4,4,3,1.16747291305186,3.875,"Low",84,27,41,100,5,4,3,1,40,52,44,75,79,59,36,100,20,2,"1",3,"Comparing my result of percentages I thought people would say versus what they really said.","None"
"392",298,623,58,58,12,100,3,4,4,4,4,4,1,2,3,4,3,4,4,0.710536405115352,4,"Low",92,92,0,100,4,3,4,1,75,89,24,95,93,94,24,100,18,2,"1",1,"I liked how it showed you what the people from 5 years ago thought about the issues","i had no challenges"
"393",301,2097,66,37,44,97,4,4,5,3,4,5,2,2,2,3,4,4,5,0.646049225628173,3.375,"Low",59,43,37,100,3,3,1,1,61,72,32,1,62,63,27,99,18,2,"1",1,"I like that we are given the answer as to what the general population thought. ","I realized I may have completed one section wrong because the wording in the question confused me. A scale with word labels as well as numbers is much easier for me to read. "
"394",302,429,50,80,50,100,3,4,4,4,4,4,3,2,2,3,3,5,3,1.07390636848532,3.625,"Low",40,80,50,100,2,3,1,1,77,59,38,100,60,80,40,100,18,2,"1",1,"getting to express my opinon","i wasn't fully informed on some of the topic so my answers may not be valid"
"395",305,823,90,70,40,100,4,4,4,4,4,4,2,3,4,3,2,4,4,0.934158627337575,3.875,"Low",90,70,40,100,1,1,2,2,30,60,9,90,60,30,19,90,18,2,"1",1,"I liked finding out the real statistics from 2018.","I was unsure about the reality of the change in ,mindset between 2018 and 2023."
"396",307,995,100,90,15,100,4,4,5,4,4,4,1,2,1,1,4,2,2,0.523460214639162,4,"Low",100,80,15,100,5,1,2,2,65,35,65,98,61,50,57,100,18,1,"1",1,"I liked seeing how my beliefs were similar or different to the beliefs of the general 2018 US population. ","I had trouble believing that at least one person didn't think that slavery or human trafficking was 100% a violation of rights."
"397",308,101861,100,100,25,100,4,4,5,3,5,5,2,2,3,3,4,3,4,4.21173774179037,4,"Low",100,100,20,100,4,1,3,2,73,60,75,85,70,65,50,100,19,2,"1",1,"I thought it was interesting to see the difference between what I thought and what 'America' thought in 2018. ","I thought differently as to what the general public thought for those prompts, which was initially a hard thing to judge in the first place."
"398",310,415,90,100,45,100,4,4,5,2,5,4,2,2,3,3,4,3,5,0.88700327742433,4.125,"Low",91,100,45,100,1,5,2,5,57,39,58,68,66,80,47,100,18,2,"1",1,"It made me realize how the world has changed even in 5 years on serious topics such as universal health care, the death penalty, slavery, and greenhouse gas emissions. ","I had no difficulties completing this exercise. "
"399",312,469,61,72,50,100,4,4,4,4,4,4,3,3,3,3,4,4,4,6.68947107512371,3.125,"Low",85,85,50,100,2,1,1,1,81,80,19,100,41,62,19,100,18,2,"1",1,"I liked the information on the people who had already answered. ","Figuring out how much I agreed or disagreed. "
"400",315,594,72,73,100,100,5,5,4,5,4,5,2,3,4,4,3,4,2,3.19916982199087,4.875,"Low",100,73,100,100,1,2,4,2,100,71,100,100,100,80,100,100,19,1,"1",1,"I liked the questions that were asked. ","none I felt that it wasn't that hard "
"401",316,21290,77,100,19,100,3,3,3,2,4,3,2,3,4,3,2,4,3,0.987538114517062,5,"Low",78,85,28,98,2,3,4,1,67,96,42,100,25,44,37,100,NA,NA,"",NA,"learning","none"
"402",319,463,50,50,50,50,3,3,3,3,3,3,3,3,3,3,3,3,1,3.63266008611272,2.5,"Low",48,47,57,53,2,4,3,2,11,11,11,5,32,33,41,35,21,1,"1",3,"Some things that I liked about the exercise I just completed is that it got me to think about some things that I never really have gotten to think about in the way that I did not. That leads to me to really thinking about what the questions are asking me and the answers I am giving back. ","Some of the challenges that I had with this exercise is that some of the information is stuff that I have never really thought about or talked about with anyone so when I was answering, I really went off of my personal preference. "
"403",320,642,100,75,50,100,4,4,5,5,5,5,1,2,4,2,3,2,2,0.701482436861384,4.125,"Low",95,75,50,100,4,1,1,3,60,28,45,80,55,58,50,98,19,2,"1",2,"I liked that the real percentages were shown","Could be clearer for what section of time and population we are doing the ranking for"
"404",322,511,43,22,21,100,4,4,4,5,5,4,1,4,3,3,4,4,3,0.619252400231347,5.25,"Low",30,20,21,100,1,1,1,1,45,45,55,95,60,50,50,99,19,1,"1",1,"I like the vast spectrum of answer choices. 1-100 is a good system. I also like the comparison to the rest of the population.","None. "
"405",324,593,100,100,61,100,4,4,4,4,3,5,2,4,5,4,4,3,5,4.06087278452542,3.5,"Low",100,100,20,100,1,1,1,1,88,99,53,100,55,88,97,57,19,2,"2,5",2,"n/a","n/a"
"406",327,741,87,72,1,100,3,3,5,4,3,5,4,2,2,3,4,4,5,2.18005236167341,3.25,"Low",90,71,0,100,2,4,3,1,69,86,95,100,82,92,6,100,19,2,"2",1,"seeing the percentage of what people agreed ","none"
"407",329,744,51,60,2,100,3,2,3,4,3,5,3,4,4,4,5,3,3,1.25464283786389,3.5,"Low",46,27,3,100,1,2,3,1,41,56,29,91,56,78,36,100,19,2,"1",2,"I liked seeing the results from the 2018 survey ","I didn't know what some of the questions were "
"408",330,598,100,46,100,100,3,3,5,4,5,5,1,2,3,3,4,3,5,3.94569500674764,3.625,"Low",100,50,71,100,5,3,1,1,71,71,29,91,90,80,31,92,20,2,"1",2,"I liked the comparisons from yourself to what the rest of the world believes.","I had to actually think about the questions."
"409",333,1973,82,81,72,100,4,4,5,5,5,5,1,2,4,4,4,5,3,0.440817813765182,4.875,"Low",86,79,51,100,5,2,1,2,70,61,50,87,74,61,49,94,21,2,"1,5",3,"I thought it was super interesting to see how the 2018 civilians thought about issues that are maybe more prevalent now.","It's hard to remember how intense the issues were back then, therefore predicting society's views was more difficult."
"410",337,669,77,74,24,92,4,3,4,4,5,5,4,3,4,3,4,3,2,2.91446359488465,2.5,"Low",83,85,1,96,1,2,3,2,55,67,59,65,64,75,11,100,19,2,"1",1,"Knowing the actual percentage of the questions from a few years ago.","I did not have any challenges."
"411",339,376,92,96,14,100,5,5,5,5,4,5,2,4,4,4,3,4,3,5.33967107512371,2.75,"Low",78,84,15,100,4,3,4,1,89,84,25,88,61,91,26,100,18,1,"5",1,"It was simple and easy to understand ","I had no challenges"
"412",341,652,62,65,50,100,4,4,4,4,4,4,4,3,3,4,4,4,2,1.17311551956815,3.875,"Low",50,50,50,100,4,4,5,2,63,50,50,100,66,50,51,100,19,1,"1",1,"I liked how I got to agree or disagree on the topic multiple times and I like how you guys measured if I was surprised or not. ","I was kind of confused on what the question was asking. "
"413",343,746,60,48,95,100,3,4,5,3,4,5,4,4,3,2,2,2,3,1.41838573356468,3,"Low",65,50,76,100,4,3,5,2,46,55,56,78,58,58,51,100,19,2,"1",1,"it showed actual data and it was very suprising ","lots of the questions sounded the same "
"414",345,1104,100,88,4,100,3,4,4,3,5,5,3,2,3,4,4,2,4,0.749077797056744,3.625,"Low",99,99,1,100,5,3,3,1,70,65,29,90,81,51,25,100,19,2,"1",1,"I liked how the real results of the survey were shared.","No challenges"
"415",347,421,81,100,30,0,4,4,2,2,3,1,5,3,2,3,3,2,1,4.12128097165992,3.25,"Low",29,51,74,100,1,3,5,1,80,89,71,1,40,64,74,100,18,1,"2",1,"The comparisons I got to see between the different years and what other people chose was interesting.","It was pretty simple nothing hard to understand."
"416",348,1290,80,90,10,100,4,4,4,4,4,5,2,2,4,2,3,2,3,1.84145240023135,4.25,"Low",82,71,10,100,4,1,4,1,71,71,39,20,39,60,20,100,19,2,"1",1,"I liked how it made you rethink the same questions several times.","I kind of got confused with the wording of the directions a few times and didn't correctly put what I thought because of this."
"417",350,1245,70,80,10,100,5,3,4,4,5,4,3,2,5,5,5,4,4,1.30790453055716,3.75,"Low",80,75,10,100,1,1,1,1,65,60,45,100,70,75,25,100,18,2,"1,5",1,"The straight-forward questions","Debating how much I agree/ disagree with each question. "
"418",353,662,100,100,82,100,5,5,5,4,5,5,2,4,2,2,4,3,4,4.28965704003599,3.125,"Low",100,100,81,100,5,5,3,1,82,51,92,100,90,72,29,100,19,2,"1",2,"I really liked estimating the answers from 2018, and then getting to see the actual results. It really put the thoughts of our society and how we may differ from them into perspective.","The death penalty question is one I go back-and-forth with. There are many people wrongfully serving the death penalty, but many, such as molesters/rapists/mass serial killers/mass shooters who I feel should have no other option but the death penalty."
"419",354,398,90,90,5,100,4,5,5,5,5,5,2,2,1,3,2,4,5,0.752042503695135,4.75,"Low",87,100,1,100,2,3,1,3,40,50,75,81,70,86,40,100,18,2,"1",1,"I liked the fact that they provided the actual data after the estimates","None"
"420",356,780,81,72,50,100,5,4,5,4,4,4,2,3,2,2,1,1,5,0.453429805282437,3.375,"Low",70,50,41,95,4,2,2,1,61,40,40,92,60,61,40,100,28,2,"2",3,"It was interesting to see the previous survey results. ","I was hard to remember what I had originally put as my answer after reading the other survey results. "
"421",358,528,93,98,50,100,4,4,5,4,5,5,3,2,3,3,2,3,2,4.15069363151468,3.125,"Low",85,96,45,100,4,5,1,1,98,100,47,100,88,95,47,100,18,2,"1,3",1,"I really enjoyed how you put the percent of the 2018 survey up and I liked how I was able to compare my answer to the others ","none"
"422",361,944,50,70,10,100,3,3,4,3,4,3,3,3,2,3,4,4,5,1.03906192404087,5.375,"Low",50,69,20,100,2,2,4,1,50,80,20,100,50,60,25,100,21,1,"5",4,"It forced me to think from the point of view of others as well as myself to give myself a better understanding of how others see the world around me and not just how I see it.","It is not always easy to take into consideration what everyone thinks about world issues. Certain issues are black and white and seem obvious but others are very split in ways that I did not expect so it is hard to tell sometimes."
"423",363,1414,81,60,50,100,4,4,4,3,5,5,3,3,4,4,3,3,4,3.0308064520275,2.625,"Low",77,60,55,100,5,2,1,1,75,50,35,98,60,48,40,100,18,2,"1",1,"The questions were straight foreword. ","Nothing really, just had to think about the questions and decide what felt right in my mind. "
"424",364,1056,100,100,100,100,3,4,5,4,5,4,3,2,3,2,2,4,4,0.74127291305186,3.625,"Low",100,100,0,100,5,2,1,1,59,60,40,98,60,55,33,99,19,1,"1,5",2,"It was interesting to see the actual results of those questions in 2018 compared to what I expected.","Some of the questions regarding ethicality of certain actions were hard to agree or disagree with because it depends on the circumstances."
"425",366,942,93,53,69,100,4,4,4,4,5,4,1,3,4,3,4,3,3,0.550061924040871,4.625,"Low",94,40,77,100,3,3,1,1,63,51,83,99,82,61,60,99,18,1,"1",1,"The slider bars ","None"
"426",369,469,50,64,28,100,3,3,3,3,4,4,2,2,2,3,3,3,3,3.14717119722383,3.125,"Low",37,41,58,100,1,1,1,1,51,37,50,86,19,33,61,100,19,1,"1",1,"I like how it compared you to the average answers from other people, and asked for opinions on strong debates that are in the world. ","I had a hard time understanding the last question and why it would even be on their, and its really unfortunate as a society we have to ask that question. "
"427",371,4580,65,21,45,100,4,3,5,3,4,4,2,3,3,3,3,4,3,0.913679133731765,4.875,"Low",50,23,10,100,3,3,4,1,50,67,15,87,50,67,33,100,19,1,"1",1,"It was interesting to see how my opinion, the thought about the public's opinion, and the public's actual opinion vary.","I just wanted to make sure I didn't misinterpret what the question was asking."
"428",372,428,100,89,23,100,5,5,5,4,4,5,2,3,3,3,3,3,4,5.35884738770002,5.125,"Low",100,100,47,0,3,3,3,3,100,82,0,0,100,100,0,0,19,1,"1",1,"I liked seeing the different numbers from the groups","way too long"
"429",374,385,50,51,1,100,3,4,4,4,4,5,2,1,3,4,2,1,4,2.94972370670265,4.375,"Low",32,49,1,100,3,2,2,1,39,76,1,100,67,90,21,100,19,1,"1",2,"it gave me facts about what other people think","whether I agree with what other people think or not"
"430",376,1231,100,100,25,100,2,5,5,3,5,5,4,3,1,1,4,2,3,1.54252040357304,3.75,"Low",100,100,27,100,1,1,1,1,100,100,25,100,100,60,61,100,19,2,"1",2,"I liked how you asked about the level of surprise and showed data from different studies.","I honestly didn't realize that we were looking at different studies from different years and percentages for a little while but that was on me."
"431",378,609,69,69,24,100,4,2,5,1,5,5,3,3,2,3,4,4,5,2.98808561146456,4.375,"Low",58,23,25,100,2,4,1,1,73,31,62,100,68,42,18,100,18,1,"1",1,"i like knowing what others think as it widens and helps me reconsider my opinions.","no challenges "
"432",381,874,100,69,58,98,4,2,5,3,4,2,2,2,2,3,4,4,2,0.442120532099479,4.875,"Low",100,68,63,100,5,2,1,1,100,70,61,98,60,68,9,92,18,1,"1",1,"Simple, not many questions so it is easy to stay focused. ","When asking what others think about the questions. Make the ""others"" highlighted to make it easier to spot. Otherwise it would be easy to answer the questions in my own opinion again. "
"433",382,736,100,50,0,100,4,4,5,5,5,5,1,3,4,3,3,2,4,1.05947291305186,4.875,"Low",100,50,0,100,4,2,4,1,100,50,0,100,100,72,1,100,18,1,"1",1,"Different times for the same survey.","Trying to assess what others answered"
"434",385,899,55,30,0,100,4,4,4,4,3,4,4,3,3,4,4,4,4,1.10351906689801,4.125,"Low",40,40,0,100,1,1,2,1,40,40,70,0,50,59,44,100,18,2,"1",1,"I liked being able to see what people's opinions were about these topics in 2018 and comparing them to my own.","It was hard for me to think estimate what I thought the percentages would be for 2018 because I was not very into politics back then."
"435",386,459,66,88,42,100,5,5,5,4,4,5,4,4,4,4,3,4,4,3.02590453055716,3.75,"Low",76,92,35,100,3,4,1,1,64,86,40,100,54,68,42,100,19,1,"1",2,"I could see not only mine but other people's options on these questions and see how surprised I was","I was grappling with some questions more on the understanding part of how they were worded and how little educated I am on on certain situations."
"436",388,403,87,88,88,91,5,5,5,2,5,5,2,2,2,2,4,4,4,1.63834128912024,4.5,"Low",88,93,71,100,2,3,4,1,87,86,86,100,92,88,92,100,19,2,"1",1,"I liked that I could see the actual percentages after I put in what I estimated. ","There were a lot of numbers to choose from"
"437",391,714,65,55,50,100,4,4,4,3,4,4,2,3,3,3,3,3,3,0.600814304993252,4.125,"Low",63,53,47,100,4,2,2,1,56,45,50,90,64,47,37,100,19,2,"1,3",1,"That we got to see results of what the public thinks. ","I did not know enough information regarding some of the topics discussed. "
